{
  "$schema": "../../../../../schema/mav_cmd_definition.schema.json",
  "name": "MAV_CMD_NAV_LOITER_TO_ALT",
  "value": 31,
  "dialect": "common",
  "params": {
    "1_Heading Required": {
      "enumRef": "MAV_BOOL"
    },
    "2_Radius": {
      "enumRef": null
    },
    "3_Empty": {
      "enumRef": null
    },
    "4_Xtrack Location": {
      "enumRef": null
    },
    "5_Latitude": {
      "enumRef": null
    },
    "6_Longitude": {
      "enumRef": null
    },
    "7_Altitude": {
      "enumRef": null
    }
  }
}
