{
  "$schema": "../../../../../schema/mav_cmd_definition.schema.json",
  "name": "MAV_CMD_AIRFRAME_CONFIGURATION",
  "value": 2520,
  "dialect": "common",
  "params": {
    "1_Landing Gear ID": {
      "enumRef": null
    },
    "2_Landing Gear Position": {
      "enumRef": null
    },
    "3_Empty": {
      "enumRef": null
    },
    "4_Empty": {
      "enumRef": null
    },
    "5_Empty": {
      "enumRef": null
    },
    "6_Empty": {
      "enumRef": null
    },
    "7_Empty": {
      "enumRef": null
    }
  }
}
