{
  "$schema": "../../../../../schema/mav_cmd_definition.schema.json",
  "name": "MAV_CMD_NAV_RETURN_TO_LAUNCH",
  "value": 20,
  "dialect": "common",
  "params": {
    "1_Empty": {
      "enumRef": null
    },
    "2_Empty": {
      "enumRef": null
    },
    "3_Empty": {
      "enumRef": null
    },
    "4_Empty": {
      "enumRef": null
    },
    "5_Empty": {
      "enumRef": null
    },
    "6_Empty": {
      "enumRef": null
    },
    "7_Empty": {
      "enumRef": null
    }
  }
}
