{
  "$schema": "../../../../../schema/mav_cmd_definition.schema.json",
  "name": "MAV_CMD_DO_GUIDED_MASTER",
  "value": 221,
  "dialect": "common",
  "params": {
    "1_System ID": {
      "enumRef": null
    },
    "2_Component ID": {
      "enumRef": null
    },
    "3_Empty": {
      "enumRef": null
    },
    "4_Empty": {
      "enumRef": null
    },
    "5_Empty": {
      "enumRef": null
    },
    "6_Empty": {
      "enumRef": null
    },
    "7_Empty": {
      "enumRef": null
    }
  }
}
