{
  "$schema": "../../../../../schema/mav_cmd_definition.schema.json",
  "name": "MAV_CMD_DO_SET_ROI_NONE",
  "value": 197,
  "dialect": "common",
  "params": {
    "1_Gimbal device ID": {
      "enumRef": null
    },
    "2_Empty": {
      "enumRef": null
    },
    "3_Empty": {
      "enumRef": null
    },
    "4_Empty": {
      "enumRef": null
    },
    "5_Empty": {
      "enumRef": null
    },
    "6_Empty": {
      "enumRef": null
    },
    "7_Empty": {
      "enumRef": null
    }
  }
}
