{
  "$schema": "../../../../../schema/mav_cmd_definition.schema.json",
  "name": "MAV_CMD_DO_PAUSE_CONTINUE",
  "value": 193,
  "dialect": "common",
  "params": {
    "1_Continue": {
      "enumRef": "MAV_BOOL"
    },
    "2_Reserved": {
      "enumRef": null
    },
    "3_Reserved": {
      "enumRef": null
    },
    "4_Reserved": {
      "enumRef": null
    },
    "5_Reserved": {
      "enumRef": null
    },
    "6_Reserved": {
      "enumRef": null
    },
    "7_Reserved": {
      "enumRef": null
    }
  }
}
