{
  "$schema": "../../../../../schema/mav_cmd_definition.schema.json",
  "name": "MAV_CMD_CONDITION_YAW",
  "value": 115,
  "dialect": "common",
  "params": {
    "1_Angle": {
      "enumRef": null
    },
    "2_Angular Speed": {
      "enumRef": null
    },
    "3_Direction": {
      "enumRef": null
    },
    "4_Relative": {
      "enumRef": "MAV_BOOL"
    },
    "5_Empty": {
      "enumRef": null
    },
    "6_Empty": {
      "enumRef": null
    },
    "7_Empty": {
      "enumRef": null
    }
  }
}
