{
  "$schema": "../../../../../schema/mav_cmd_definition.schema.json",
  "name": "MAV_CMD_DO_RETURN_PATH_START",
  "value": 188,
  "dialect": "common",
  "params": {
    "1_Empty": {
      "enumRef": null
    },
    "2_Empty": {
      "enumRef": null
    },
    "3_Empty": {
      "enumRef": null
    },
    "4_Empty": {
      "enumRef": null
    },
    "5_Latitude": {
      "enumRef": null
    },
    "6_Longitude": {
      "enumRef": null
    },
    "7_Altitude": {
      "enumRef": null
    }
  }
}
