{
  "$schema": "../../../../../schema/mav_cmd_definition.schema.json",
  "name": "MAV_CMD_WAYPOINT_USER_2",
  "value": 31001,
  "dialect": "common",
  "params": {
    "1_User defined": {
      "enumRef": null
    },
    "2_User defined": {
      "enumRef": null
    },
    "3_User defined": {
      "enumRef": null
    },
    "4_User defined": {
      "enumRef": null
    },
    "5_Latitude": {
      "enumRef": null
    },
    "6_Longitude": {
      "enumRef": null
    },
    "7_Altitude": {
      "enumRef": null
    }
  }
}
