{
  "$schema": "../../../../../schema/mav_cmd_definition.schema.json",
  "name": "MAV_CMD_REQUEST_PROTOCOL_VERSION",
  "value": 519,
  "dialect": "common",
  "params": {
    "1_Protocol": {
      "enumRef": "MAV_BOOL"
    },
    "2_Reserved (all remaining params)": {
      "enumRef": null
    }
  }
}
