{
  "$schema": "../../../../../schema/mav_cmd_definition.schema.json",
  "name": "MAV_CMD_DO_FENCE_ENABLE",
  "value": 207,
  "dialect": "common",
  "params": {
    "1_Enable": {
      "enumRef": null
    },
    "2_Types": {
      "enumRef": "FENCE_TYPE"
    },
    "3_Empty": {
      "enumRef": null
    },
    "4_Empty": {
      "enumRef": null
    },
    "5_Empty": {
      "enumRef": null
    },
    "6_Empty": {
      "enumRef": null
    },
    "7_Empty": {
      "enumRef": null
    }
  }
}
