{
  "$schema": "../../../../../schema/mav_cmd_definition.schema.json",
  "name": "MAV_CMD_NAV_PAYLOAD_PLACE",
  "value": 94,
  "dialect": "common",
  "params": {
    "1_Max Descent": {
      "enumRef": null
    },
    "2_Empty": {
      "enumRef": null
    },
    "3_Empty": {
      "enumRef": null
    },
    "4_Empty": {
      "enumRef": null
    },
    "5_Latitude": {
      "enumRef": null
    },
    "6_Longitude": {
      "enumRef": null
    },
    "7_Altitude": {
      "enumRef": null
    }
  }
}
